{
  "content_type": "marketing",
  "id": "contact",
  "locales": [
    "vi"
  ],
  "semantic_spec": "content-system/specs/contact.yaml",
  "entries": [
    {
      "key": "meta.contact.title",
      "component": "meta",
      "notes": "Lean recompile 2026-08-26. The form submits a consultation request and does not book a calendar appointment.",
      "locales": {
        "vi": "Liên hệ Pebble Vina — gửi yêu cầu tư vấn"
      }
    },
    {
      "key": "meta.contact.description",
      "component": "meta",
      "claims": [
        "C019"
      ],
      "notes": "Tax code carried per decisions/meta-tax-code. C019 licenses 0111545175 and the group-member phrasing; the street address is deliberately absent because Landmark 72 and floor 19 have no ledger entry.",
      "locales": {
        "vi": "Pebble Vina — thành viên Việt Nam của nhóm Pebble Square Inc. Văn phòng Hà Nội, MST 0111545175. Gọi 0345 913 369 hoặc email contact@pebblevina.com."
      }
    },
    {
      "key": "contact.intro.kicker",
      "component": "eyebrow",
      "notes": "Lean recompile 2026-08-26. Plain task label, no index number, brand echo or urgency prompt. Renders mono uppercase; Vietnamese diacritics must survive.",
      "locales": {
        "vi": "Trao đổi bài toán"
      }
    },
    {
      "key": "contact.intro.title",
      "component": "headline",
      "notes": "Lean recompile 2026-08-26. Directly names the one action required on this page and the receiving party. One line of thought, no courtesy preamble, no booking implication.",
      "locales": {
        "vi": "Pebble Vina đang chờ tiếp nhận bài toán của bạn"
      }
    },
    {
      "key": "contact.intro.lead",
      "component": "body",
      "claims": [
        "C049"
      ],
      "notes": "One sentence only. C049 names the sales owner, the submitted-contact route and the wall-clock 24-hour commitment after successful form submission; it does not promise diagnosis or a solution.",
      "locales": {
        "vi": "Trong vòng 24 giờ sau khi doanh nghiệp gửi form thành công, nhân viên kinh doanh Pebble Vina sẽ liên hệ qua email hoặc số điện thoại đã cung cấp."
      }
    }
  ]
}
