{
  "content_type": "product_ui",
  "id": "lead.save",
  "locales": [
    "vi",
    "en",
    "ko"
  ],
  "entries": [
    {
      "key": "lead.save.button",
      "component": "button",
      "locales": {
        "en": "Save changes",
        "vi": "Lưu thay đổi"
      }
    },
    {
      "key": "lead.save.toast",
      "component": "toast",
      "locales": {
        "en": "Lead saved",
        "vi": "",
        "ko": "리드가 저장되었습니다"
      }
    }
  ]
}
