{
  "content_type": "marketing",
  "id": "footer",
  "semantic_spec": "content-system/specs/footer.yaml",
  "locales": [
    "vi"
  ],
  "entries": [
    {
      "key": "footer.tagline",
      "component": "body",
      "claims": [
        "C019"
      ],
      "notes": "Subject is the entity, not a category — a platform cannot sign a contract (spec chrome.footer.tagline). Wording of the relationship is the proof-bank §F licence verbatim: member of the group, never subsidiary, no ownership figure. Sits under the 'Pebble Vina' heading, so the name is not repeated.",
      "locales": {
        "vi": "Thành viên của nhóm Pebble Square, ký hợp đồng và xuất hoá đơn tại Việt Nam."
      }
    },
    {
      "key": "footer.navTitle",
      "component": "label",
      "notes": "Regenerated from the spec and landed on the existing string. Plain, accurate, not CMS furniture; also serves as the nav aria-label.",
      "locales": {
        "vi": "Các trang"
      }
    },
    {
      "key": "footer.contactTitle",
      "component": "label",
      "notes": "Was 'Kênh liên hệ' — 'channels' is translation smell (critic). Bare 'Liên hệ' was rejected by STYLE_DUPLICATE_TEXT against nav.contact and would have put an identical word in two adjacent footer columns; 'Thông tin liên hệ' is the plain VN heading for what the column holds and parallels 'Hồ sơ doanh nghiệp'.",
      "locales": {
        "vi": "Thông tin liên hệ"
      }
    },
    {
      "key": "footer.legalTitle",
      "component": "label",
      "claims": [
        "C019"
      ],
      "notes": "decisions.legal_column_heading. The spec's informal C_ENTITY/C_TAXID both project to ledger id C019 (entity + tax code, proof-bank §F). Heading names what the column holds — entity, tax code, group membership — and promises no terms/privacy document.",
      "locales": {
        "vi": "Hồ sơ doanh nghiệp"
      }
    },
    {
      "key": "footer.statusLegend",
      "component": "label",
      "notes": "decisions.status_legend — states the label system, never a colour. Uses the badge strings verbatim: status.shipped 'Đã có', status.roadmap 'Dự kiến' (glossary shipped-label / roadmap-label).",
      "locales": {
        "vi": "Mỗi số liệu đều mang nhãn đã có hoặc dự kiến"
      }
    },
    {
      "key": "footer.disclaimer",
      "component": "caption",
      "notes": "Sentence 1 kept (source + read date — what makes it checkable). Sentence 2 dropped per chrome.footer.disclaimer: the roadmap disclosure is already attached inline at the point of claim (home.history.milestones[14].statusNote), so repeating it here reads as pre-emptive self-defence. C017 citation dropped with that sentence.",
      "locales": {
        "vi": "Số liệu về Pebble Square Inc. lấy từ trang chính thức pebble-square.com, đọc ngày 20/08/2026."
      }
    },
    {
      "key": "labels.parent",
      "component": "label",
      "notes": "decisions.parent_relationship_label — <dt> for the FactRow whose <dd> is SITE.parent.name + city (site.ts, untouched). Row reads 'Thành viên của: Pebble Square Inc. — Seongnam, Hàn Quốc'. States the licensed relationship, claims no ownership.",
      "locales": {
        "vi": "Thành viên của"
      }
    }
  ]
}
