{
  "content_type": "product_ui",
  "id": "campaign.delete",
  "locales": ["vi", "en", "ko"],
  "semantic_spec": "campaign.delete.confirm",
  "entries": [
    {
      "key": "campaign.delete.title",
      "component": "dialog_title",
      "destructive": true,
      "locales": {
        "en": "Delete campaign?",
        "vi": "Xoá chiến dịch?",
        "ko": "캠페인을 삭제할까요?"
      }
    },
    {
      "key": "campaign.delete.body",
      "component": "dialog_body",
      "destructive": true,
      "locales": {
        "en": "The campaign and its {count, plural, one {# scheduled post} other {# scheduled posts}} will be deleted. This action cannot be undone.",
        "vi": "Chiến dịch và {count, plural, other {# bài đã lên lịch}} sẽ bị xoá. Không thể hoàn tác.",
        "ko": "캠페인과 {count, plural, other {예약된 게시물 #개}}가 삭제됩니다. 이 작업은 되돌릴 수 없습니다."
      }
    },
    {
      "key": "campaign.delete.confirm",
      "component": "button",
      "destructive": true,
      "primary_action": true,
      "locales": {
        "en": "Delete campaign",
        "vi": "Xoá chiến dịch",
        "ko": "캠페인 삭제"
      }
    },
    {
      "key": "campaign.delete.cancel",
      "component": "button",
      "locales": {
        "en": "Cancel",
        "vi": "Huỷ",
        "ko": "취소"
      }
    }
  ]
}
