{
  "content_type": "product_ui",
  "id": "contact.form",
  "locales": [
    "vi"
  ],
  "semantic_spec": "content-system/specs/contact.yaml",
  "entries": [
    {
      "key": "contact.form.title",
      "component": "label",
      "notes": "Lean recompile 2026-08-26. Two-to-four-word label naming the request the form submits; no calendar-booking implication.",
      "locales": {
        "vi": "Yêu cầu tư vấn"
      }
    },
    {
      "key": "contact.form.nameLabel",
      "component": "label",
      "locales": {
        "vi": "Họ và tên"
      }
    },
    {
      "key": "contact.form.companyLabel",
      "component": "label",
      "locales": {
        "vi": "Công ty"
      }
    },
    {
      "key": "contact.form.emailLabel",
      "component": "label",
      "locales": {
        "vi": "Email"
      }
    },
    {
      "key": "contact.form.phoneLabel",
      "component": "label",
      "notes": "The only optional field. labels.call already renders `Điện thoại` in the hero dl, so this one takes the fuller form-field name.",
      "locales": {
        "vi": "Số điện thoại"
      }
    },
    {
      "key": "contact.form.messageLabel",
      "component": "label",
      "notes": "Uses the same noun the page uses in contact.intro.title, so the field and the invitation match.",
      "locales": {
        "vi": "Bài toán cần giải"
      }
    },
    {
      "key": "contact.form.messagePlaceholder",
      "component": "placeholder",
      "notes": "An example, not an instruction. The three details mirror contact.intro.lead so a reader who scrolled past it recognises the shape. Numbers are safe here: check_claims skips the number scan on a product_ui artifact, and this is an illustrative example, not a customer.",
      "locales": {
        "vi": "Ví dụ: 12 máy CNC, cần phát hiện rung bất thường trước khi hỏng, dữ liệu không được rời nhà máy."
      }
    },
    {
      "key": "contact.form.optionalLabel",
      "component": "label",
      "notes": "Rendered by the component as ` · <value>` after the phone label.",
      "locales": {
        "vi": "Không bắt buộc"
      }
    },
    {
      "key": "contact.ctaPrimary",
      "component": "button",
      "primary_action": true,
      "notes": "Recompiled 2026-08-25 by decisions/submit-posts-to-endpoint — the form POSTs to /api/contact, so the button may now name a delivery it actually performs. Verb plus object in the reader's own terms: they came for tư vấn, not to submit a form. A bare `Gửi` is in lint_product's vi vague-action list and is rejected for the reason behind the rule, not only by it. 18 of the 28 characters vi allows for a button; it replaces a 20-character label, so the button does not grow.",
      "locales": {
        "vi": "Gửi yêu cầu tư vấn"
      }
    },
    {
      "key": "contact.form.successTitle",
      "component": "success",
      "state": "success",
      "notes": "Lean recompile 2026-08-26. Confirms successful receipt once and names Pebble Vina as the receiver. No terminal period.",
      "locales": {
        "vi": "Pebble Vina đã nhận yêu cầu"
      }
    },
    {
      "key": "contact.form.successBody",
      "component": "success",
      "state": "success",
      "claims": [
        "C049"
      ],
      "notes": "Lean recompile 2026-08-26. The successful receipt starts C049's 24-hour clock. One sentence names the sales owner and the route through the submitted details; no acknowledgement email, diagnosis or solution promise.",
      "locales": {
        "vi": "Nhân viên kinh doanh sẽ liên hệ qua email hoặc số điện thoại đã cung cấp trong vòng 24 giờ."
      }
    },
    {
      "key": "contact.form.errorBody",
      "component": "error",
      "state": "error_unknown",
      "notes": "New field on ContactContent.form, first copy 2026-08-25. Shown when the POST does not return ok, inline beside the still-live submit button, role=\"alert\". State, then two actions (references/product/errors.md) — press the button again, or reach a person. No cause: the component is handed none, and 429, 5xx and a dead network are one state to the reader; naming one would be a guess printed as a fact, and a status code would be PRODUCT_TECHNICAL_LEAKAGE. No apology — `rất tiếc` / `có lỗi xảy ra` are the vi generic-failure patterns and vi.md's error rule is state, then action. `Chưa`, not `Không`: the failure is retryable and the word says so. ENDS ON A COLON BY REQUIREMENT — the component appends `<a>{phone}</a> · <a>{email}</a>` immediately after this string, so a full stop here would strand a phone number as its own sentence. Neither value is retyped into vi.ts; both stay in web/content/site.ts.",
      "locales": {
        "vi": "Chưa gửi được yêu cầu. Thử lại hoặc liên hệ trực tiếp:"
      }
    }
  ]
}
