{
  "content_type": "product_ui",
  "id": "lead.count",
  "locales": [
    "vi",
    "en",
    "ko"
  ],
  "entries": [
    {
      "key": "lead.count.summary",
      "component": "toast",
      "locales": {
        "en": "{count, plural, one {# lead} other {# leads}} assigned to {owner}.",
        "vi": "{soluong, plural, other {# lead}} đã gán cho người phụ trách.",
        "ko": "{count, plural, one {리드 #개} other {리드 #개}}가 {담당자}에게 지정되었습니다."
      },
      "state": "assign_success"
    }
  ]
}
