{
  "content_type": "marketing",
  "id": "products.hardware.papaya-pair",
  "locales": [
    "vi"
  ],
  "semantic_spec": "content-system/specs/products.yaml — blocks/products.hardware.papaya, repair_2026_08_24_papaya_pair",
  "entries": [
    {
      "key": "products.hardware.items[1].body",
      "component": "body",
      "notes": "Repair, not a rewrite. Sentence 1 replaces the old 25x clause (now a SpecCard of its own) with the only thing the merged block gained: which of the two names each number was measured on — docs/01-proof-bank.md §E2, three rows PAPAYA FLEX, one row PAPAYA. Symmetric on purpose: `lấy trên … / của … ở …` reports provenance and implies nothing about how the two parts relate, which the proof bank does not carry (open_decisions/papaya-pair-relationship). No claim is cited because none can be: C005, C034 and C007 all require their counterparty in the same string, and naming three counterparties here would duplicate the strip 40px below. Sentence 2 survives from the approved pass, minus `thì GPU vẫn đúng` → `vẫn cần GPU`. 32 words, 2 sentences, first sentence 17 — length_budget/product_body. Second pass: `còn PAPAYA` replaces `của PAPAYA` — with the ellipsis alone the second name reads as an abbreviation of the first, which would hand the ~10.000× figure to PAPAYA FLEX. `còn X` marks a new topic and cannot be read as apposition. 32 words, first sentence 17.",
      "locales": {
        "vi": "Số đo của PAPAYA FLEX lấy trên tải thị giác máy, còn PAPAYA ở trạm gốc 5G. Lợi thế là điện và kích thước — huấn luyện mô hình lớn vẫn cần GPU."
      }
    },
    {
      "key": "products.hardware.items[1].specs[0].label",
      "component": "label",
      "claims": [
        "C005"
      ],
      "notes": "Names the tier. `chip PAPAYA FLEX` follows the pattern MINT's own label already uses (`Hiệu suất năng lượng chip MINT`). `thấp hơn` stays: a bare `so với` leaves ~50× readable in both directions.",
      "locales": {
        "vi": "Điện năng chip PAPAYA FLEX, thấp hơn NVIDIA Jetson Nano"
      }
    },
    {
      "key": "products.hardware.items[1].specs[0].note",
      "component": "body",
      "claims": [
        "C005"
      ],
      "notes": "`cùng tải thị giác máy (ResNet-50)` removed. §E2 attaches ResNet-50 to the FPS/W row only; the power row has no workload in the source, and the benchmark now has its own card directly beside this one.",
      "locales": {
        "vi": "0,1–0,15 W so với 5–10 W của NVIDIA Jetson Nano."
      }
    },
    {
      "key": "products.hardware.items[1].specs[0].source",
      "component": "caption",
      "notes": "Unchanged string; listed so the four source lines in the strip are read as one decision.",
      "locales": {
        "vi": "Pebble Square IR Deck 05/01/2026 — số do hãng tự công bố"
      }
    },
    {
      "key": "products.hardware.items[1].specs[1].value",
      "component": "caption",
      "notes": "NEW card. docs/01-proof-bank.md §E2 row 2, previously unused on the page.",
      "locales": {
        "vi": "~100×"
      }
    },
    {
      "key": "products.hardware.items[1].specs[1].label",
      "component": "label",
      "notes": "No claim cited here on purpose: C006 requires BOTH `ResNet-50` and `Jetson Nano` in every string that cites it, and a label carrying both runs to three lines in a half-column at lg. The benchmark sits in the note 6px below, inside the same card, where C006 is cited in full.",
      "locales": {
        "vi": "Hiệu suất chip PAPAYA FLEX, cao hơn NVIDIA Jetson Nano"
      }
    },
    {
      "key": "products.hardware.items[1].specs[1].note",
      "component": "body",
      "claims": [
        "C006"
      ],
      "notes": "ResNet-50 is mandatory context for this figure (§E2). FPS/W written once, after the pair of ranges.",
      "locales": {
        "vi": "333–500 so với 3,6–7,2 FPS/W của NVIDIA Jetson Nano, đo trên ResNet-50."
      }
    },
    {
      "key": "products.hardware.items[1].specs[1].source",
      "component": "caption",
      "notes": "Same document as the other three, named differently because STYLE_DUPLICATE_TEXT is an ERROR on an identical string under two keys — a citation line cannot be repeated verbatim in this system. The variation carries the one thing that differs: this row is a benchmark, not a datasheet figure.",
      "locales": {
        "vi": "Pebble Square IR Deck 05/01/2026 — benchmark của hãng"
      }
    },
    {
      "key": "products.hardware.items[1].specs[2].value",
      "component": "caption",
      "notes": "NEW card. §E2 row 3 / C034 — the figure the body used to carry as prose.",
      "locales": {
        "vi": "~25×"
      }
    },
    {
      "key": "products.hardware.items[1].specs[2].label",
      "component": "label",
      "claims": [
        "C034"
      ],
      "locales": {
        "vi": "Kích thước chip PAPAYA FLEX, nhỏ hơn NVIDIA Jetson Nano"
      }
    },
    {
      "key": "products.hardware.items[1].specs[2].note",
      "component": "body",
      "claims": [
        "C034"
      ],
      "notes": "The two measurements are quoted exactly as §E2 states them. Nothing is added about WHAT is 10×10 mm and what is 70×45 mm — the source does not say die, package or module, and an engineer will ask.",
      "locales": {
        "vi": "10×10 mm so với 70×45 mm của NVIDIA Jetson Nano."
      }
    },
    {
      "key": "products.hardware.items[1].specs[2].source",
      "component": "caption",
      "locales": {
        "vi": "Pebble Square IR Deck 05/01/2026 — kích thước theo hãng"
      }
    },
    {
      "key": "products.hardware.items[1].specs[3].value",
      "component": "caption",
      "notes": "Moved from specs[1] — the strip is now grouped by part, three PAPAYA FLEX rows then the PAPAYA row. String unchanged; vi thousands separator is a dot (brand/voice.yaml number_format).",
      "locales": {
        "vi": "~10.000×"
      }
    },
    {
      "key": "products.hardware.items[1].specs[3].label",
      "component": "label",
      "claims": [
        "C007"
      ],
      "notes": "Rewritten. Was `Điện cho tác vụ AI tại trạm gốc 5G`, which read as a PAPAYA FLEX number in a PAPAYA FLEX block — docs/05-backlog.md #34. Now names the part, keeps §E2's mandatory scope (`cho tác vụ AI`, not the whole station) and carries the counterparty in the label rather than the note alone: this is the largest multiple on the site and the one most likely to be quoted on its own.",
      "locales": {
        "vi": "Điện năng chip PAPAYA cho tác vụ AI tại trạm gốc 5G, thấp hơn NVIDIA L4"
      }
    },
    {
      "key": "products.hardware.items[1].specs[3].note",
      "component": "body",
      "claims": [
        "C007"
      ],
      "notes": "Unchanged string, moved path. C007's qualification is the second sentence and may not be dropped when shortening.",
      "locales": {
        "vi": "So với NVIDIA L4: 320–332 W còn 0,03 W. Cho riêng tác vụ AI, không phải cả trạm."
      }
    },
    {
      "key": "products.hardware.items[1].specs[3].source",
      "component": "caption",
      "notes": "Unchanged, moved path. It was going to take the same caveat as the other three, and could not: identical citation strings are a hard ERROR here. The document and its date are named, which for an investor deck already says whose number this is.",
      "locales": {
        "vi": "Pebble Square IR Deck 05/01/2026"
      }
    }
  ]
}
