{
  "content_type": "product_ui",
  "id": "campaign.delete",
  "locales": [
    "vi",
    "en",
    "ko"
  ],
  "entries": [
    {
      "key": "campaign.delete.title",
      "component": "dialog_title",
      "locales": {
        "en": "Delete campaign?",
        "vi": "Xoá chiến dịch?",
        "ko": "캠페인을 삭제할까요?"
      },
      "destructive": true
    },
    {
      "key": "campaign.delete.body",
      "component": "dialog_body",
      "locales": {
        "en": "Are you sure?",
        "vi": "Bạn có chắc không?",
        "ko": "정말 삭제하시겠습니까?"
      },
      "destructive": true
    },
    {
      "key": "campaign.delete.confirm",
      "component": "button",
      "locales": {
        "en": "OK",
        "vi": "Đồng ý",
        "ko": "확인"
      },
      "destructive": true,
      "primary_action": true
    }
  ]
}
