{
  "content_type": "marketing",
  "id": "home.hero",
  "locales": [
    "vi",
    "en",
    "ko"
  ],
  "entries": [
    {
      "key": "home.hero.headline",
      "component": "headline",
      "locales": {
        "en": "Vietnam's #1 AI chip company",
        "vi": "Công ty chip AI số 1 Việt Nam",
        "ko": "베트남 1위 AI 반도체 기업"
      }
    },
    {
      "key": "home.hero.lead",
      "component": "subheadline",
      "locales": {
        "en": "Trusted by leading enterprises, our industry-leading platform delivers military-grade security and zero data leakage.",
        "vi": "Được các doanh nghiệp hàng đầu tin dùng, nền tảng tốt nhất thị trường mang lại bảo mật tuyệt đối an toàn.",
        "ko": "업계 최고의 플랫폼으로 완벽한 보안을 제공합니다."
      }
    }
  ]
}
